ASEN 5325,Small Scale Processes in Geophysical Fluids,"Provides an overview of mixing and wave processes in the oceans and the atmosphere. Topics include turbulent boundary layers in the lower atmosphere and the upper ocean, air-sea interactions, and surface and internal waves."
ASEN 5331,Computational Fluid Dynamics Unstructured Grid,"Focuses on unstructured grid computational approaches to solve the Navier-Stokes equations. Assumes a basic knowledge of the solution of partial differential equations with numerical methods with focus finite element/volume methods (FEM/FVM but primarily FEM). These issues include: the discrete formulation, non-linear equation iterator, linear equation formation, boundary condition prescription and linear equation solution."
ASEN 5335,Aerospace Environment,"Examines the components of the solar-terrestrial system and their interactions to provide an understanding of the re-entry and orbital environments within which aerospace vehicles operate. Includes the sun, solar wind, magnetospere, ionosphere, thermosphere, radiation belts, energetic particles, comparative environments (Mars, Venus, etc.), orbital debris, spacecraft charging, particle effects on systems, shielding, and satellite drag. "
ASEN 5347,Math Methods in Dynamics,"Two-part graduate-level course on dynamics. Covers both flexible and rigid multibody analytical dynamics and finite element method for dynamics. Emphasizes formulations that naturally lead to easy computer implementation and stability, linearization, and modern rotational kinematics. Department consent required."
ASEN 5417,Numerical Methods in Engineering and Science,"Provides computational skills and basic knowledge of numerical methods for advanced courses in engineering/scientific computation using Fortran, C, or Matlab. "
ASEN 5426,Neural Systems and Physiological Control,"A biophysical exploration of human physiology from the standpoints of control systems and neural information processing. Topics include: neural control of movement and cardiovascular performance, tissue growth and repair, carcinogenesis, and physiological responses to microgravity. "
ASEN 5440,Mission Design and Development for Space Sciences,Brings science and engineering students together to develop the multidisciplinary skills required to create a successful proposal to develop a NASA-funded small space mission. Goals: 1) develop the proposal science objectives based on scientific community priorities and NASA Announcement of Opportunity. 2) Understand how science requirements lead to the design of instrumentation. 3) Understand practical aspects of mission development. 
ASEN 5506,Bioastronautics Seminar,"Focuses on current topics related to space habitat systems design and research aimed at understanding the effects of spaceflight on living organisms ranging from humans down to microbes. Literature analysis and scientific presentations are expected. Emphasis is on biophysical mechanisms, comprehensive models, and related technology development."
ASEN 5519,Selected Topics,Reflects upon specialized aspects of aerospace engineering sciences. Course content is indicated in the online Class Search. 
ASEN 5849,Independent Study,Study of special projects.
ASEN 5940,Engineering Research Internship,"Grants credit to foreign visiting graduate students for conducting research within the Aerospace Engineering Sciences department. Credits can be transferred to the student's home institution. CU-Boulder students may also receive credit for conducting research outside of the university, either overseas or in the US."
ASEN 6008,Interplanetary Mission Design,"Exploration of principles and methods related to the design and construction of trajectories for interplanetary mission design. Some topics covered include: two-and three-body motion, gravity assists, maneuver computation, navigation, numerical integration, and construction of orbits. The main focus is on simple ballistic mission designs, such as Galileo or Cassini, however, libration point trajectories will also be covered. "
ASEN 6009,Special Topics Seminar,Presents research and developments in each department's focus areas.
ASEN 6010,Advanced Spacecraft Dynamics and Control,"Studies the dynamic modeling and control of spacecraft containing multiple momentum exchange devices, and/or flexible spacecraft components. Will develop nonlinear feedback control algorithms, explore singularity avoidance strategies. The second half of the course derives analytical methods (D'Alembert's equations, Lagrange's equations, Boltzmann Hamel equations) to model a hybrid rigid/flexible spacecraft system."
ASEN 6011,Experimental Fluid Mechanics,"This course presents an intermediate level introduction into the theory and practice of performing experimental measurements in fluid mechanics. The fundamental principles and definitions associated with instrumentation, measurement procedures, data analysis, and uncertainty quantification will be discussed. A specific focus will be placed on the application of a variety of measurement techniques in low-speed aerodynamic environments. A selection of measurement techniques will be extensively studied and applied including: classical pressure and temperature measurements, thermal (hot-wire) anemometry, laser doppler anemometry, particle image velocimetry, surface and field flow visualization techniques, schlieren and shadowgraph photography techniques. Undergraduates may enroll with instructor permission. Previously offered as a special topics course."
ASEN 6013,High Speed Propulsion,"Covers air-breathing and rocket propulsion cycles, their relative performance trade-offs, and how they fit within the context of a vehicle system. Specific emphasis will be placed on fundamental cycle analyses, component level design, and propulsion/airframe integration for rockets, turbojets, ramjets, scramjets, combined cycles, and other advanced propulsion concepts. "
ASEN 6014,Spacecraft Formation Flying,"Studies the dynamic modeling and control of spacecraft formations orbiting about a planet. Investigate linear and nonlinear relative motion descriptions, rectilinear and curvilinear coordinates, orbit element difference based descriptions, J 2-invariant relative orbits, as well as Lyapunov-based relative motion control strategies. "
ASEN 6015,Space Vehicle Guidance and Control,"The course gives a comprehensive view of guidance systems used in space vehicles, and methods for analyzing the performance of these systems. The types of guidance systems that will be covered are launch vehicle ascent, intercept/rendezvous, interplanetary, orbit station-keeping, atmospheric re-entry, lander, and low-thrust. The mathematical foundation of these systems will be derived and discussed. Real world applications will be presented by reviewing selections from published literature. Course work will emphasize the analysis of the guidance system performance to achieve stated goals. Previously offered as a special topics course."
ASEN 6020,Optimal Trajectories,"Introduces the theory and practice of trajectory optimization. The general theory behind optimization and optimal control will be introduced with an emphasis on the properties of optimal trajectories. The main application will be to space trajectories, but other applications will also be considered. "
ASEN 6021,Viscous Flow,"Studies low Reynolds number flows, including incompressible and compressible laminar boundary layer theory; similarity theory; and separation, transition, and turbulent boundary layers. "
ASEN 6024,Nonlinear Control Systems,"Introduces the analysis and control design methods for nonlinear systems, including Lyapunov and Describing Function methods."
ASEN 6028,Graduate Projects II,"Exposes MS and PhD students to leadership positions in project management and systems engineering while working a complex aerospace engineering project as part of a project team. The project team may perform some or all of the following project activities during this second semester of the two-semester course sequence: requirements definition, design and design review, build, test, and verification. "
ASEN 6037,Turbulent Flows,Studies turbulent closure methods and computational procedures used to solve practical turbulent flows. Emphasizes multi-equation models used with time-averaged equations to calculate free-turbulent shear-flows and turbulent boundary layers. Employs spectral methods in direct and large-eddy simulation of turbulence. Formerly ASEN 5037.
ASEN 6050,Space Instrumentation,"Provides an overview of the relevant space environment and process, the types of instruments flown on recent mission and the science background of the measurement principles. "
ASEN 6055,Data Assimilation & Inverse Methods for Earth & Geospace Observations,"Covers a selection of topics in probability theory, spatial statistics, estimation theory, numeric optimization, and geophysical nonlinear dynamics that form the foundation of commonly used data assimilation and inverse methods in the Earth and Space Sciences. Hands-on computational homework and projects provide opportunities to apply classroom curricula to realistic examples in the context of data assimilation."
ASEN 6060,Advanced Astrodynamics,"Covers Lagrangian and Hamiltonian formalisms for astrodynamics problems, the computation and characterization of space trajectories in highly dynamic environments, computation of periodic orbits, stability analysis of orbital motion, and development of analytical theories for dynamics. "
ASEN 6061,Molecular Gas Dynamics and DSMC,"Describes the composition and flow of gases on a microscopic level to examine the behavior of the molecules that make up a macroscopic flow system. Thermodynamic properties, transport phenomena, and the governing Boltzmann Equation are derived from molecular collision dynamics and the kinetic theory. The Direct Simulation Monte Carlo method is introduced with applications."
ASEN 6070,Satellite Geodesy,"Focuses on the measurement of the Earth's gravitational field, rotational characteristics, and shape using Earth and space-based tracking of artificial satellites. Particular emphasis on satellite altimetry and satellite gravity measurements. "
ASEN 6080,Statistical Orbit Determination,"Course on orbit and advanced estimation techniques. Emphasizes orthogonal transformation techniques such as Givens and Householder, square root filtering and smoothing and considers covariance analysis. Also nonlinear filters and dynamic model compensation techniques. Requires term project that involves the application of many of the techniques required for precise orbit determination."
ASEN 6090,Advanced Global Navigation Satellite Systems: Software and Applications,"Focuses on high-precision applications of Global Navigation Satellite Systems (GNSS) and the software tools that are needed to achieve these precisions. Topics include precise orbital determination, reference frames, atmospheric delays, relativity, clock models, ambiguity resolution, and scientific applications. "
ASEN 6091,Global Navigation Satellite System (GNSS) Receiver Architecture,Investigates the overall architecture of satellite navigation receivers: including both the analog radio frequency conditioning (antenna to the analog-to-digital converter) and the various signal processing algorithms. Such treatment of the operation of the receiver will provide insight into the trade-offs that go into GNSS as well as the more broad generic spread spectrum receiver design. 
ASEN 6107,Nonlinear Finite Element Methods,Continuation of ASEN 5007. Covers the formulation and numerical solution of nonlinear static structural problems by finite element methods. Emphasizes the treatment of geometric nonlinearities and structural stability. 
ASEN 6116,Spacecraft Life Support Systems,"Study the environmental control and the life support systems and technologies that keep people alive and healthy in spacecraft and habitats. Students will learn about thermal control systems, air revitalization processes, water reclamation and treatment, waste handling and the reuse of materials, and food and nutrition. Expect to develop analytical models from first principles and perform hands-on laboratory experiments. Formerly ASEN 5116."
ASEN 6265,Fundamentals of Spectroscopy for Optical Remote Sensing,"Provides a comprehensive overview of the fundamentals of quantum physics, atomic spectroscopy, molecular spectroscopy and laser spectroscopy. Exposes students to the spectroscopy applications in modern optical and laser remote sensing. Assists students to develop the fundamental knowledge and skills for independent learning."
ASEN 6337,Remote Sensing Data Analysis,"Covers some of the most commonly used machine learning techniques in remote sensing data analysis, specifically for clustering, classification, feature extraction and dimensionality reduction, and inverse methods used to retrieve geophysical information from remote sensing data. Hands-on computational homework and group and individual projects provide opportunities to apply classroom curricula to real remote sensing data."
ASEN 6365,Lidar Remote Sensing,"Provides a comprehensive, yet easily understandable, up-to-date understanding of lidar principles, technologies and applications. Contains approaches for quantitative lidar simulation, lidar sensitivity and error analysis, lidar data retrieval, lidar system design and performance analysis. Gives students opportunities to see and operate real state-of-the-art lidar systems and make connections to lidar experts in the nation and world."
ASEN 6367,"Advanced Finite Element Methods for Plates, Shells, and Solids","Continues ASEN 5007. Covers more advanced FEM applications to linear static problems in structural and continuum mechanics. Focuses on modeling, formulation and numerical solutions of problems modeled as plates, shells and solids. Includes an overview of advanced variational formulations. "
ASEN 6412,Uncertainty Quantification,This advanced topics course provides an exploration of techniques for representation and propagation of uncertainty in PDE/ODE-based systems. 
ASEN 6427,Advanced Computational Fluid Dynamics,Introduces computational techniques particularly applicable to high-speed gas flows that contain shocks. Complicated numerical methods are developed from relatively simple numerical modules. 
ASEN 6517,Computational Methods In Dynamics,"Covers modeling, computational algorithms and their computer implementation for both linear and nonlinear dynamical systems. Topics covered include transient analysis, wave propagation, multiphysics analysis, and their significant engineering applications. "
ASEN 6519,Special Topics,Reflects upon specialized aspects of aerospace engineering sciences. Course content is indicated in the online Schedule Planner. 
ASEN 6800,Master of Engr Project,
ASEN 6849,Independent Study,Studies special projects agreed upon by student and instructor.
ASEN 6949,Master's Candidate for Degree,
ASEN 6950,Master's Thesis,
ASEN 8990,Doctoral Dissertation,
