PSCI 4715,Honors Political Science Seminar,Involves writing and discussion of selected topics in political science. Critically reviews the major methodological and conceptual features of the discipline. Students begin their honors papers in the seminar. Department enforced prerequisite: minimum 3.3 GPA. Generally offered in fall term only.
PSCI 4716,Selected Policy Problems,"Integrates general principles of policy inquiry with documents and other literature on specific problems in public policy, in order to evaluate courses of action. "
PSCI 4725,Political Science Honors Thesis,Involves writing an honors thesis. Formerly PSCI 4008.
PSCI 4731,Civic Engagement in America,"Closely examines the various understandings of democracy, the arguments for and against democracy, and the progress of and prospects for democratic politics in the United States. Particular attention is paid to economic, social, and political developments in the United States that affect popular sovereignty, political equality, and liberty. "
PSCI 4732,Critical Thinking in Development,"Exposes students to current issues in the political economy of development. Subjects range from globalization, democratization and economic development. Specifically explores the international and domestic determinants of economic development with special reference to currency markets, foreign direct investment, trade and democratization. "
PSCI 4734,Politics and Literature,Broadly examines political topics as they are presented in important literary works and analyzes the possibilities involved in using the literary mode to present political teachings. 
PSCI 4751,The Politics of Ideas,"Examines theoretical arguments and case studies of interactions of ideas, interests, and institutions in policymaking. Analyzes processes through which ideas come to the public agenda, how institutional settings shape those ideas, and why some ideas and interests are more successful. "
PSCI 4771,Civil Rights and Liberties in America,"Implementation of rights and liberties in America. Examines fundamental issues of free speech, press, association, and religion along with rights to due process and equal protection under the law."
PSCI 4783,Global Issues,"Studies the principal issues confronting humanity that affect stability and survivability and their economic, social, and political implications. "
PSCI 4792,Issues in Latin American Politics,"Studies several Latin American countries in some depth including history and contemporary politics. Teaches students to listen to and evaluate different sides of political controversies, and critically evaluate arguments. "
PSCI 4841,Independent Study in American Politics,Subjects are chosen and arrangements are made to suit the needs of each student. Independent study is for upper-division students who have completed 9 credit hours of political science and who have an overall GPA of at least 3.00. Not more than 6 credit hours of independent study may be credited toward the minimum requirements in the political science major. A special independent study approval agreement form must be obtained from the department. 
PSCI 4842,Independent Study in Comparative Politics,Subjects chosen and arrangements made to suit needs of each student. Independent study is for upper-division students who have completed 9 credit hours of political science and who have an overall GPA of at least 3.00. Not more than 6 credit hours of independent study may be credited toward the minimum requirements in the political science major. Special independent study approval agreement form must be obtained from the department. 
PSCI 4843,Independent Study in International Relations,Subjects chosen and arrangements made to suit needs of each student. Independent study is for upper-division students who have completed 9 credit hours of political science and who have an overall average of at least 3.00. Not more than 6 credit hours of independent study may be credited toward the minimum requirements in the political science major. Special independent study approval agreement form must be obtained from the department. 
PSCI 4844,Independent Study in Political Theory,Subjects and arrangements suit individual student needs. Independent study is for upper-division students who have completed 9 credit hours of political science and who have an overall GPA of at least 3.00. Not more than 6 credit hours of independent study may be credited toward the minimum requirements in the political science major. Special independent study approval agreement form must be obtained from the department. 
PSCI 4846,Independent Study in Public Policy,Subjects chosen and arrangements made to suit needs of each student. Independent study is for upper-division students who have completed 9 credit hours of political science and who have an overall average GPA of at least 3.00. Not more than 6 credit hours of independent study may be credited toward the minimum requirements in the political science major. Special independent study approval agreement form must be obtained from the department. 
PSCI 4848,Independent Study,Subjects chosen and arrangements made to suit needs of each student. Independent study is for upper-division students who have completed 9 credit hours of political science and who have an overall average of at least 3.00. Not more than 6 credit hours of independent study may be credited toward the minimum requirements in the political science major. Special independent study approval agreement form must be obtained from the department. 
PSCI 4938,Internship in Government,"With instructor's assistance, students secure an internship with a political or governmental organization. In addition to the internship, the class consists of regular seminars, course readings and assignments, and individual conferences with the instructor. Student pursues an academic research project and writes an original research paper. Instructor approval required in semester preceding internship. Contact instructor prior to early registration. "
PSCI 6851,Interdisciplinary Social Science Professional Socialization,"Trains graduate students and provides professional socialization in interdisciplinary social science research. Open to all interested students, with programming provided by the Institute of Behavioral Science. Sessions include IBS-housed colloquia and workshops in professional socialization, technological tools, interdisciplinary research, ethics, grant writing, etc. Students workshop and submit a research paper. "
PSCI 6948,Master's Candidate for Degree,
PSCI 7002,Seminar in West European Politics,"Examines West European politics in terms of general theories of comparative politics, including institutional, behavioral and political economy approaches."
PSCI 7004,Seminar: Political Theory,Allows for intensive research in and presentation of selected topics. Introduces students to the broad context within which political ideas arise. Deals with classical and modern thought. 
PSCI 7008,Teaching Political Science,Designed to prepare graduate student teachers in the essentials of political science teaching and provide a background in theories of political science teaching and practical skills development in discipline-specific education.
PSCI 7011,Seminar: American Politics,"Core field seminar for students of American politics. Course work emphasizes the diversity of contemporary research on American political history, political institutions, and political behavior."
PSCI 7012,Seminar: Comparative Political Systems,Discusses current literature on comparative politics including theoretical and methodological issues. 
PSCI 7013,Seminar: International Relations,"Reviews salient literature on international relations, and subsequent presentation and critical discussion of analytical studies. Allows students wide latitude in substantive and methodological approaches. Emphasizes changing trends and efforts to understand the bases for cooperation and conflict. "
PSCI 7021,Latinos and U.S. Politics,"Examines in depth the theoretical and empirical literature assessing the political situation and activities of Latinos (Mexican Americans, Puerto Ricans, Cuban Americans, and others) in the U.S. Stresses original research."
PSCI 7022,Seminar in Political and Economic Development,"Covers domestic political and economic development in Latin America, Africa, and Asia, as well as interactions with the global economy. Includes defining, explaining, and prescribing policies for successful development, and comparing the experiences of developing and industrialized countries."
PSCI 7024,Seminar: Selected Political Theories,Familiarizes students with selected political philosophies or theories in classical or modern political thought. 
PSCI 7028,Teaching Political Science 2,Second course designed to train graduate teachers in the essentials of political science teaching and provide a background in theories of political science teaching and practical skills development in discipline specific education.
PSCI 7031,Seminar: Political Attitudes and Behavior,"Provides an intensive examination of topics in political attitudes and behavior such as political participation, ideology, voting, and elite behavior. Reviews methodology of behavioral research and introduces ICPSR data archive and computer-based research."
PSCI 7032,Seminar: Latin American Politics,Stresses intensive study of the political process in Latin America with special emphasis on democratization.
PSCI 7043,Seminar: Problems of International Organization,"Studies selected problems concerning administration and operation of public international organizations, including the United Nations and its specialized agencies. Considers decision making, executive leadership, internal organization, personnel policies, coordination of activities, and financing."
PSCI 7046,Seminar: Urban Public Policy,"Focuses on formulation, revision, and outcomes of public policy in American urban communities. Also uses some comparative Canadian and European literature."
PSCI 7051,Seminar: The United States Congress,Comprehensively examines literature and selected research topics concerning the United States Congress.
PSCI 7052,Democracy & Authoritarianism,Examine differences between democracies and authoritarian regimes; the choices and the consequences of democratic institutions in authoritarian regimes; and the causes of authoritarian survival and demise and the subsequent political choice. 
PSCI 7053,War and Peace,"Explores the conditions that promote conflict between countries, focusing on broad and systemic explanations of war and peace. Investigates classical as well as current behavioral approaches to understanding why countries fight."
PSCI 7055,Introductory Game Theory,Develops competence in engaging formal theories of politics and in constructing and solving basic game-theoretic models of political behavior.
PSCI 7056,Readings in Public Policy,"Explores diverse approaches to policy choice, change, and learning processes. Overviews literature on policy determinants and typologies, policy subsystems, innovation and diffusion, agenda setting, implementation, problem definition and social construction, policy design, institutional analysis, and policy and democratic values."
PSCI 7062,The Politics of Ethnicity,"Explores the political aspects of pluralism, ethnonationalism, separatism, and related phenomena. Examines theories of ethnic mobilization, conflict,and accommodation in the context of political development and nation building. Includes cross-polity comparisons and case studies of multiethnic societies in the developed and developing world. "
PSCI 7071,Seminar: An Introduction to the Rule of Law,"Introduces students to debates about the role of institutions, particularly but not exclusively legal institutions, in placing limits on the state and fostering the rule of law. What is law? Why do courts exist and what is their role in the state? What institutions are necessary to establish the rule of law? Why are institutions successful in some contexts and not others? Considers these questions by surveying classic and current research from American and comparative politics literatures on topics such as judicial independence, credible commitments, separation of powers and constitutional design."
PSCI 7073,Seminar: Global Political Economy,"Introduces graduate students to concepts, theories, and data used to study the global system from a political-economic framework. Examines world systems analysis, regime change theory, and dependency theory with respect to operation of the exchange and power relationship within the contemporary world system."
PSCI 7075,Scope and Methods of Political Science,"Introduces students to research design, with a subsequent focus on professional development. Students learn about different styles of research, central methodological points surrounding (and differentiating) these styles, and standards for evaluating research, regardless of approach or content."
PSCI 7085,Introduction to Political Science Data Analysis,"Provides intensive experience with quantitative techniques commonly employed in political science research, covering basic inferential and descriptive statistics through multiple regression. Students undertake substantive research projects, requiring lab instruction in the use of the computer in quantitative applications of political science research."
PSCI 7091,Politics of Social Movements,Examines theoretical and empirical research on American social movements. Emphasizes the role of movements as political actors and their ability to bring about changes in public policy and national political institutions.
PSCI 7095,Advanced Political Data Analysis,"Provides advanced training in the statistical modeling of political relationships. Focuses on the properties and assumptions of the ordinary least squares regression model, building on material covered in PSCI 7085: Introduction to Political Science Data Analysis."
PSCI 7108,Special Topics,Various topics not normally offered in the curriculum. Topics vary each semester. 
PSCI 7111,Seminar: American Political Institutions,"Intensive examination of the structure and rules of different political institutions in the United States. Explores both the changing approaches to the study of American political institutions as well as many ofthe major research topics on the presidency, Congress, the judiciary, and the bureaucracy."
PSCI 7114,Survey of Historical and Contemporary Political Theory,"Examines major texts of Western political thought from the ancients through the 21st century. Introduces students to major schools of contemporary political theory, while situating these in their larger political context. Professionalizes students through presentations and research projects. Texts vary each semester. "
PSCI 7115,Qualitative Methods,Develop proficiency in constructing research designs with qualitative methods. The goal is to understand and be able to justify research designs involving relatively small numbers of observations as good political science given the fact that such designs may limit our ability to generalize.
PSCI 7116,Context-Sensitive Research Methods,"Prepares students to conduct research on topics where data is not obvious or not easily available. Encompasses variations in context and setting as part of data observations. Methods include interviewing protocols, interpretive methods, cluster analyses, case study methodologies and textual analyses. "
PSCI 7123,Civil Conflict,"Surveys historical, theoretical, and empirical analyses of violent conflict behavior, including the causes and consequences of civil war, protests, insurgency, terrorism, revolution, and intervention."
PSCI 7124,Contemporary Democratic Theory,Surveys major schools of contemporary democratic theory and introduces students to current scholarly debates about democracy and democratic politics. Professionalizes students through class presentations and research projects. Specific controversies and texts vary each semester. 
PSCI 7126,Introduction to Public Policy,"Designed for graduate students specializing in the field of public policy in the political science program. Surveys a wide variety of approaches to the analysis and understanding of public policy. The course is not a survey of any particular set of substantiative policy areas but instead is intended as an examination of the enduring puzzles that analysts of public policy commonly confront, the kinds of research methodologies that they employ, and a selection of the techniques that they bring to bear on their research questions."
PSCI 7131,Political Psychology,"Focuses on the psychological roots of political behavior, including the origins of political beliefs, political decision-making processes, and the psychology of group interactions."
PSCI 7132,Comparative Political Economy,"Explores the relationship between economics and politics in developed and developing countries. Gives students an historical overview of 20th century economic trends and covers scholarly approaches totopics such as political and economic institutions, economic ideas and interests, the political causes of growth and equality, globalization and the welfare state, and varieties of capitalism. "
PSCI 7136,Public Policy and Behavioral Science,"Public policy is usually designed with the assumption that we make optimal choices based on our own best interests. Findings from the behavioral sciences, however, challenge this traditional view and reveal that a wide array of factors influence our decisions. In this course, we will explore the gaps between how we assume individuals to behave and how people actually behave. With better knowledge of what motivates human behavior, we will examine and discuss how policy might be better designed and executed to improve outcomes in society."
PSCI 7143,Strategic Choice of Political Conflict,"Explores the conditions under which political actors go to war, and the conditions under which they broker peace. Approaches political conflict from the perspective of strategic choice. Conflict is not an accident, but is the deliberate result of decisions by actors. Actors choose conflict when bargaining obstacles prevent them from reaching a peaceful agreement."
PSCI 7145,Advanced Game Theory,"Covers more advanced applications of game theory in political science. Equips students with the skills to design and solve models at a reasonably high level of complexity and generality, and to understand how to effectively make use of such models in their research."
PSCI 7151,American Subnational Politics and Government,"Provides a comprehensive overview of the issues and literature concerning American Subnational politics. Considers three bodies of literature: American federalism and intergovernmental relations, state politics, and urban/local politics. Also examines a number of policy issues."
PSCI 7155,Maximum Likelihood Estimation and Generalized Linear Models,"Introduces maximum likelihood estimation and extends the linear model to several generalized linear models. Provides students with the skills to analyze and understand a broad class of outcome variables and data structures such as dichotomous outcomes, counts, ordered and unordered categorical outcomes and bounded variables. Also examines several special topics such as multilevel models, causal inference and missing data."
PSCI 7165,Experimental Methods,"Focuses on the design, implementation, and analysis of experiments in political science, including lab experiments, survey experiments, and field experiments."
PSCI 7171,Seminar: Law and Democratic Governance,"Explores cutting-edge debates in election law. Studies different perspectives on the current controversies in the field, in addition to select opportunities to engage scholars directly about their work. Develops students' understanding of the law of democracy, exposing students to some of the best scholarship, and improving students' ability to evaluate and critique legal scholarship. "
PSCI 7172,Comparative Political Institutions,"Institutional theory has burgeoned across the social sciences in the last three decades. This course aims to raise awareness and understanding of institutional theory in comparative politics, as compared to alternative approaches such as political economy, political behavior, etc., and to help students develop skills to communicate this awareness and understanding to other professional political scientists."
PSCI 7173,The Politics of International Factor Flows,"Focuses on the second dimension of international trade: the politics of international factor flows. Economic globalization can be defined as the freer flow of (1) goods and services (i.e., international trade) and (2) factors of production (e.g., capital and labor) across national borders. Links these topics in International Political Economy to broader theories of International Relations, namely Institutionalism and Liberalism."
PSCI 7175,Dissertation Seminar,"Help students make progress towards (1) in the short term: focusing in on a dissertation topic, crafting a dissertation prospectus, and identifying potential funding sources; and (2) in the long term: sending papers out for review, developing a package for the job market, and understanding the academic job market and the tenure process."
PSCI 7181,Immigration Law and Immigrants' Rights,"Addresses four broad questions: Who is a citizen of the United States? Who else can come to this country? When and why can noncitizens be forced to leave? Who has the authority to answer these questions? These questions prompt us to examine the history of U.S. immigration, the constitutional-statutory-regulatory framework that governs immigration and citizenship law and the federal agencies that administer it. Also addresses contemporary challenges to, and assertions of, immigrants' rights. "
PSCI 7183,International Cooperation,"Investigates the origins, forms and consequences of international cooperation. The course covers both theoretical material related to international cooperation and various related global issue areas; security, economy, environment and social welfare. For each issue area, the key theoretical debates, empirical findings, as well as central challenges and parameters that constrain international cooperation will be investigated."
PSCI 7185,Political Network Analysis,"Explores all aspects of political network analysis including disciplinary background, theories and concepts, approaches and applications, data basics and measurement, and techniques of analysis. Data assignments use software such as UCINET and R. Introduces visualization software including NetDraw, NetworkX and Cytoscape."
PSCI 7191,Law and Politics Colloquium: Race in America,"A co-taught colloquium that exposes students to highly prominent scholars conducting research on current topics at the intersection of race, social science and the law, including racial profiling, hate crime and affirmative action. Students will complete a final paper satisfying the CU Law seminar requirement. "
PSCI 7203,Political Economy of International Migration and Policy,"Provides an overview of the seminal and cutting edge research on the political economy of international migration including both immigration and emigration. Covers a diverse set of international migration issues, including public attitudes toward immigration, special interest politics of immigration policy making and the dynamics between political institutions and international migration."
PSCI 7206,Public Policy and the Governance of Natural Resources,"Addresses a basic empirical puzzle in comparative environmental policy: why are some governmental organizations able to create relatively functional governance arrangements for natural resources management, while many others fail to do so? More specifically, we will seek to understand the particular contextual conditions that make successful governance transformations more likely."
PSCI 7222,Comparative Political Behavior,Provides an introduction to research on behavioral processes and outcomes using readings mainly from the sub-fields of American Politics and Comparative Politics. Geographic emphasis leans toward advanced democracies because this is how behavioral research has generally developed but will also explore works by developing country experts. The main goals are to help students become familiar with the existing literature and to help them explore several key debates in the field.
PSCI 7255,Time Series and Pooled Time Series,"Time series modelsmodels which take advantage of variation over time in a single unitand pooled time series (sometimes called cross-sectional time series or time series cross-sectional) modelswhich utilize variation across both time and spatial unitsare very common in political science. While these models offer substantial leverage over important social science problems that use purely cross-sectional data, there are a number of pitfalls that are necessary to avoid during estimation. "
PSCI 7306,Program Evaluation,"Focuses on applying the tools of causal inference and program evaluation to various policy issues. The course materials explore whether programs meet their desired goals. There are a number of ways in which the effectiveness of a program can be defined and measured. Empirical applications based on real-world data will be drawn from a wide range of policy areas, including education, welfare, unemployment, discrimination, health, immigration, the environment, and economic development. Previously offered as a special topics course."
