CHEM 6401,Seminar: Physical Chemistry,"Student, faculty, and guest presentations of current research in physical chemistry. Discussion of research topics related to the subject of weekly physical chemistry/chemical physics seminar and appropriate journal articles."
CHEM 6411,Advanced Topics in Physical Chemistry,Lect. 
CHEM 6801,Departmental Research Seminar,Lectures by visiting scientists and occasionally by staff members and graduate students on topics of current research. Meets once a week. Required for all graduate students in chemistry.
CHEM 6901,Research in Chemistry,
CHEM 6941,Master's Candidate for Degree,
CHEM 6951,Master's Thesis,
CHEM 7021,Seminar: Structural Inorganic Chemistry,Current research in the area of structural inorganic chemistry. Concerns topics related to electronic and molecular structure of transition metal complexes. Department consent required.
CHEM 7101,Seminar: Chromatography and Trace Analysis,"Student and faculty discussions and reports on research advances in chromatography, trace analysis and environmental chemistry. Department consent required."
CHEM 7111,Seminar: Electrochemistry,Student and faculty discussions and reports on research advances in electrochemistry. Department consent required.
CHEM 7131,Seminar in Atmospheric Aerosol Chemistry,"Discusses advances in atmospheric aerosol chemistry, with emphasis on new methods for analysis and their application to laboratory and field studies. "
CHEM 7161,Seminar: Heterogeneous Atmospheric Chemistry,Topics in atmospheric chemistry emphasizing the structure and reactivity of atmospheric particulates. Presentations on current research and critical evaluations of recent literature. Department consent required.
CHEM 7211,Seminar: Topics in Synthetic Methodology and Natural Product Synthesis,Discussion of contemporary synthetic organic chemistry with a focus on new methodology and total synthesis of natural products.
CHEM 7221,Seminar: Photochemistry and Free Radical Chemistry,"Current research in areas of organic free radical chemistry, photochemistry, and related topics are presented and discussed. Department consent required."
CHEM 7231,Seminar: Reactive Intermediates,Application of contemporary ideas of chemical physics to organic molecules. Special attention to structures and bonding in organic ions and radicals. Department consent required.
CHEM 7241,Seminar: Synthetic Organic Chemistry,Series of seminars on directed total synthesis. Emphasizes modern synthetic methodology and applications to total synthesis of natural products. Department consent required.
CHEM 7251,Selected Topics in Chemical Genetics,"Discusses the brief history of the emerging field of chemical genetics, and focuses on the recent development of concepts, techniques, applications, and its impact on both science and human health. "
CHEM 7271,Seminar: Picosecond Dynamics of Reactions,Includes development and application of picosecond laser spectroscopy to organic and organometallic reactions. Emphasizes relationship between current theoretical developments and experiments. Department consent required.
CHEM 7281,Seminar: Molecular Self-Assembly,"Discusses current topics and recent advances in molecular self-assembly, with emphasis on new liquid crystal designs and applications. "
CHEM 7291,Seminar: Physical Organic Chemistry,"Modern experimental techniques and theoretical models in physical organic chemistry are discussed in relation to the development of new materials, such as molecular size tinkertoys to the development of novel photochemical systems and their spectroscopies. Department consent required."
CHEM 7301,Seminar: Synthetic and Mechanistic Chemistry,Discusses particularly the synthesis of complex organic molecules and the mechanism of reagents used in organic synthesis. Includes a study of transition metal mediated organic reactions. Department consent required.
CHEM 7311,Selected Topics in Organic Materials,"Current research in the area of organic/materials chemistry. Concerns topics related to organic materials synthesis, carbon nanotube functionalization, artificial photosynthesis, gas storage and catalysis. "
CHEM 7401,Seminar in Photochemical Reaction Control,"Discusses progress towards control of molecular reactivity using light, including synthetic methods for creating control subjects. Emphasizes new methods to achieve coherent control. "
CHEM 7421,Seminar: Negative Ion Chemistry,Chemistry of negative ions; experimental methods and designs; laser spectroscopy of ions; theoretical methods; reactive dynamics of ions in the gas phase. Department consent required.
CHEM 7431,Seminar: Topics in Theoretical Chemical Physics,Seminars presented on a variety of topics in theoretical chemical physics. Molecular collisions and unimolecular dynamics predominantly featured. Department consent required.
CHEM 7441,Research Seminar: Theoretical Chemistry,"Studies theoretical description of molecular dynamicsas related to rate processes. Focuses on chemical reactions in liquids, absorption-desorption on surfaces, nucleation reactions, and energy flow in molecules. Department consent required."
CHEM 7461,Seminar: Gas Phase Ion Chemistry,"Studies gas phase ion chemistry relevant to thermochemical measurements and atmospheric, interstellar, and biomedical applications."
CHEM 7471,Seminar in Ultrafast Spectroscopy of Proteins,"Discusses advances and developments in biomolecular dynamics, and considers the connection of protein dynamics with function. Emphasizes experimental studies via ultrafast laser spectroscopy. "
CHEM 7481,Seminar: Molecular Spectroscopy and Photochemistry,Discussion and presentation of current research in spectroscopy and photochemistry of organic as well as organometallic systems. Reviews state of the art techniques available for the theoretical and experimental characterization of excited states. Department consent required.
CHEM 7491,Seminar: Molecular Vibrational Dynamics,"Topics pertaining to vibrational dynamics of small molecules are discussed, with particular emphasis upon IR laser spectroscopy, van der Waals' clusters, vibrationally induced dipole moments, and predissociation. Discussion of current research and recently published literature. Department consent required."
CHEM 7501,Seminar: Theoretical Molecular Dynamics,"Variety of topics in theoretical chemical physics, emphasizing dynamics of molecules in dissipative environments or in radiation fields. Department consent required."
CHEM 7511,Seminar: Reaction Dynamics in Condensed Phases,Studies elementary steps in chemical reactions and their observation by ultrafast spectroscopy. Department consent required.
CHEM 7521,Seminar: Atmospheric Kinetics and Photochemistry,Discusses laboratory studies of degradation mechanisms. Applies these studies to atmospheric phenomena such as global warming and stratospheric ozone loss. Department consent required.
CHEM 7531,Seminar: Surface Chemistry and Thin Film Growth,"Topics in surface chemistry and thin film growth with focus on atomic layer deposition (ALD) and molecular layer deposition (MLD). Properties of thin films grown using ALD and MLD. Applications of thin films in areas including flexible displays, energy storage and catalysis. Department consent required."
CHEM 7551,Selected Topics in Ion Spectroscopy,"Treats current topics in the spectrocscopy of ions. Seminar lectures are given by graduate students on their research and on literature topics, and the results of both in-house and external research groups are studied. Additionally, ideas for interesting directions of research and new experiments are proposed and discussed. "
CHEM 8991,Doctoral Dissertation,"All doctoral students must register for 30 hours of dissertation credit as part of the requirements for the degree. For a detailed discussion of doctoral dissertation credit, refer to the Graduate School section."
