HIST 3628,Seminar in Recent Chinese History,"Capstone seminars are designed for advanced history majors to pull together the skills they have honed in previous courses. This seminar focuses on recent Chinese history, and will include readings and discussions in a small seminar setting. In relation to the course topic, students will develop an individual research project and write a substantial and original paper based on primary sources. "
HIST 3713,Seminar in Russian History,"Capstone seminars are designed for advanced history majors to pull together the skills they have honed in previous courses. This seminar focuses on Russian history, and will include readings and discussions in a small seminar setting. In relation to the course topic, students will develop an individual research project and write a paper based on primary sources. "
HIST 3718,Seminar in Japanese History,"Capstone seminars are designed for advanced history majors to pull together the skills they have honed in previous courses. This seminar focuses on Japanese history, and will include readings and discussions in a small seminar setting. In relation to the course topic, students will develop an individual research project and write a substantial and original paper based on primary sources. "
HIST 3800,Seminar in Global History,"Organized around themes that change year to year, this seminar allows students to explore and research processes, phenomena, and events of global significance in historical context. Stress will be upon subjects that span multiple world areas. Possible topics include: the international arms trade; slavery; health and disease; youth culture; women's rights; genocide. See department for current theme. "
HIST 3840,Independent Study,
HIST 3841,Independent Study,
HIST 3842,Independent Study,
HIST 3843,Independent Study,
HIST 3844,Independent Study,
HIST 3845,Independent Study,
HIST 3846,Independent Study,
HIST 3847,Independent Study,
HIST 3848,Independent Study,
HIST 3849,Independent Study,
HIST 4013,Law and Society in Premodern England to 1688,"Examines the origins and developments of English legal and political institutions, including kingship, the common law, procedure and the court and jury system and sets such developments in the context of broader social and religious changes from the Anglo-Saxon period to the 17th century. Emphasizes the implications of these institutions for the development of contemporary American, English and British colonial legal systems. "
HIST 4018,"Aztecs, Incas, and the Spanish Conquest of the Americas","Building upon contemporary texts and modern histories of both famous and ordinary people, this course examines the indigenous empires known as the Aztecs and the Incas. It also examines the encounter of Europeans and native people, following the history of exploration and conquest from the time of Columbus to about 1550. Equal consideration is given to the course's three components: Aztec, Inca and the Spanish conquest. "
HIST 4020,Topics in Comparative History,Explores historical themes from a comparative perspective. Encourages students to think more analytically about historical change. Consult current online schedule for specific topics. Often team-taught by more than one faculty. 
HIST 4021,Athens and Greek Democracy,Studies Greek history from 800 B.C. (the rise of the city-state) to 323 B.C. (the death of Alexander the Great). Emphasizes the development of democracy in Athens. Readings are in the primary sources. 
HIST 4031,Alexander the Great and the Rise of Macedonia,Covers Macedonia's rise to dominance in Greece under Philip II and the reign and conquests of Alexander the Great. 
HIST 4040,The History of Space Exploration and Defense,"This course examines the development and impact of American, Soviet/Russian, and European civilian and military space activities from the dawn of the space age to the space challenges of the 21st century."
HIST 4041,Classical Greek Political Thought,"Studies main representatives of political philosophy in antiquity (Plato, Aristotle, Cicero) and of the most important concepts and values of ancient political thought. No Greek or Latin required. "
HIST 4050,A Global History of World War II,"Examines World War II in a global perspective. This era witnessed transformations in the social, political and economic orders across the globe. Traces the domestic and international developments, including military issues, that shaped the period in Europe, Asia, Africa and North America and assesses the war's legacy."
HIST 4053,"Britain and the Empire, 1688-1964","Examines the external polity of Great Britain from 1688 to 1964 in Europe, the East, Africa and the Americas. "
HIST 4061,Twilight of Antiquity,"Explores the reasons for the fall of the Roman Empire in the western Mediterranean and its survival in the east as Byzantium. Emphasizes Christianity; barbarians; social, economic and cultural differences; contemporary views of Rome; and modern scholarship. No Greek or Latin is required. "
HIST 4071,Seminar in Ancient Social History,"Considers topics ranging from demography, disease, family structure, and the organization of daily life to ancient slavery, economics, and law. Focuses either on Persia, Greece, or Rome and includes a particular emphasis on the methodology required to reconstruct an ancient society, especially the interpretation of problematic literary and material evidence, and the selective use of comparisons with better known societies. No Greek or Latin required. "
HIST 4081,The Roman Republic,Studies the Roman Republic from its foundation in 753 B.C. to its conclusion with the career of Augustus. Emphasizes the development of Roman Republic government. Readings are in the primary sources. No Greek or Latin required. 
HIST 4091,The Roman Empire,"Studies Imperial Roman history beginning with the Roman Revolution and ending with examination of the passing of centralized political authority in the western Mediterranean. Emphasizes life, letters and personalities of the Empire. "
HIST 4101,Greek and Roman Slavery,"Surveys slavery in ancient Greece and Rome beginning with its growth, economics and political effects, moving to the life experiences of slaves, resistance and revolt, and finishing with the ideology of slavery. Focuses throughout on the challenge of understanding classical slavery on the basis of scattered and biased evidence and on the controversies that have surrounded this topic. "
HIST 4103,England from the Viking Age to the Tudors,During the Middle Ages Germanic values of honor and retribution became deeply ingrained in the warrior culture of the English aristocracy. This course begins with an examination of the Scandinavian and Germanic roots of this warrior culture before exploring the residue of that culture in the centuries leading up to the Tudor period. 
HIST 4109,World War II in Asia and the Pacific,"For Asia, World War II began with the Mukden Incident (1931), resulting in the Japanese domination of Manchuria and leading to a full-scale war between China and Japan in 1937. Only after the Japanese attacked the U.S. Pacific fleet at Pearl Harbor four years later did the United States enter the war. Discusses the various socioeconomic and political factors leading to the war in Asia, examines the nature of the conflict on the Asian mainland and in the Pacific, and assesses legacy of the war on all those involved."
HIST 4116,"History of U.S. Foreign Relations, 1865-1940","Traces the rise of the United States to world power. Explores the interactions of expansionist and isolationist impulses with politics, ideology, culture and economics, with a focus on the Spanish American War and the acquisition of empire, World War I and the coming of World War II. "
HIST 4117,Colorado History,"Presents the story of the people, society, culture, and environment of Colorado from the earliest Native Americans, through the Spanish influx, the fur traders and mountain men, the gold rush, railroad builders, the cattlemen and farmers, the silver boom, the twentieth-century tourists, city-dwellers, workers and activists. Highlights the historical origins of twenty-first century institutions, problems, challenges, and opportunities. "
HIST 4118,History of Mexico to 1821,"Studies Mexican history beginning with roots and evolution of pre-Columbian civilizations and concluding with the events of Mexican independence in 1821. Emphasizes society and culture of the Aztecs and Mayans, the Spanish conquest of Mexico, and the colonial regime of New Spain."
HIST 4122,Europe During the Renaissance,"Explores the history and culture of Western Europe, 1300-1520. Comprehensive in scope, with analysis of political, economic, social, religious, intellectual and artistic matters. Discusses significance of the Renaissance for origins of modern civilization. "
HIST 4123,Kings & Commoners in an Age of Crisis: English History 1327-1487,"England in the 14th and 15th centuries endured climate change, the Black Death, peasant revolts, foreign and civil war and the forcible removal of five kings; yet this period also saw renewed forms of religious devotion, famous military victories and the exaltation of kingship. Crucially, it also saw the growing importance of the common people in English politics and the notion that government should aspire to serve the common good of the whole realm. "
HIST 4125,Early American History to 1763,"Explores the colonial era of American history from the pre-Columbian period to the end of the Seven Years' War. Topics include pre-contact Native societies, exploration, European settlement and Native American responses, labor system and the rise of slavery, imperial wars, and the developments in religion, society, politics and culture. "
HIST 4126,History of U.S. Foreign Relations Since 1941,"Traces the development of the United States as a superpower. Details American power and diplomacy in World War II and the rise of the national security state in the Cold War. Explores the Korean, Vietnam and Persian Gulf Wars, and the era of modern-day globalization. "
HIST 4128,The History of Modern Mexico Since 1821,"Centers on the Mexican search for political consolidation and stability through the 19th, 20th and 21st centuries. Focuses on the Mexican Revolution (1910-1940) and the post revolutionary rule of the Institutional Revolutionary Party. Examines the War on Drugs and the causes of Mexican migration to the United States. "
HIST 4131,The Origins of Christianity,"Surveys the sources for the development of ancient Christianity from the ministry of Jesus Christ to the conversion of the emperor Constantine in the early 4th century. Through lectures and a close reading of primary source materials in translation, students will examine the social activity and theological development of early Christians in their Roman and Jewish context."
HIST 4133,The Tudors: British History 1485-1603,"Deals with the history of England from 1485 to 1603. Examines patterns of daily life, the impact of the Reformation and the Renaissance and the development of Parliament and the monarchy under the Tudor rulers, especially Henry VIII and Elizabeth. "
HIST 4143,The Making of Great Britain: British History 1603-1714,"Covers the history of the British Isles from 1603 to 1714, the era of the English Civil War and the Glorious Revolution. Traces economic and social relationships, cultural change and religious and political conflict under the Stuart monarchs. "
HIST 4146,U.S. Military History since 1898,"Examines America's national defense and war efforts from the Spanish American War to the present, emphasizing causes and consequences of modern conflicts, and the impact of military activities on American society. "
HIST 4158,History of Modern Brazil,"Surveys the post independence history of 19th and 20th century Brazil. Looks at the development of Brazilian nationalism and political institutions and focuses heavily on race, ethnicity, gender and sexuality in Brazil, understanding how different peoples have settled and accommodated themselves to the Brazilian environment. Finally, it will look at Brazilian economic development and its consequences at the beginning of the 21st century."
HIST 4166,The Vietnam War in Politics and Culture,"Examines America's second-longest and most divisive war from the beginning of the U.S. involvement in the 1950s to the repercussions echoing into the 1980s. Considers the global context, motives, and evolution of U.S. involvement, support for and opposition to the war at home, the war's repercussions in international policy and domestic politics, and representations of the war in popular culture. "
HIST 4190,French Connections: Contemporary France and America in Historical Context,"Faculty-led Global Seminar, based in Bordeaux, France provides an opportunity to compare French history and contemporary culture, economy, and culture to that of the United States. Lectures in Boulder and Bordeaux are supplemented by interactions with officials, scholars, business leaders, interest groups, and organizations in France. Offered through Study Abroad. "
HIST 4205,"The Colonial Wars and the Coming of American Independence, 1739-1776","Investigates imperial warfare and its effects during the late colonial period, concentrating on the French and Indian War (1754-1763), the disruption of Anglo-American relations and the origins of the War of American Independence (1775-1783). "
HIST 4207,The American West to 1800,"Addresses the history of the early West until 1800. Probes the origins of the first Americans, early cultures and civilizations, and the consequences of Spanish, French, and Russian colonization. Topics addressed include warfare, disease, diplomacy, environmental change, missionary enterprises, captives, gender, and the slave trade. "
HIST 4212,"The Age of Religious Wars: Reformation Europe,1500-1648","Traces the history of Europe from the end of the Hundred Years War through the Thirty Years War. During this period Europe experienced tremendous changes including emerging religious heresies, the advent of the Spanish Inquisition, violent civil wars, the witch craze, and the Thirty Years War, a precursor to the World Wars of the 20th century. "
HIST 4215,"The Revolutionary War and the Making of the American Republic, 1775-1801","Investigates the Revolutionary War and its impact on the creation of American political institutions, as well as its cultural, social and economic effects, from the Battles of Lexington and Concord through the inauguration of Thomas Jefferson. "
HIST 4217,The American West in the 19th Century,"Explores cultural, social and political interaction in the American West during the 19th century. Themes include environmental change; conflict and syncretism across race, class, and gender lines; mythic images, and their relationship to the Real West. "
HIST 4218,Lost Kingdoms & Caliphates: West Africa to 1900,"Investigates the formation and dissolution of West Africa's kingdoms, caliphates and stateless societies during the era of the trans-Atlantic and trans-Saharan slave trades. Through a survey of oral and written sources, this course examines West Africa's geopolitical transformation in warfare, jihad, trade and slavery, especially in relation to the African Diaspora to the Americas and Muslim world."
HIST 4222,"War and the European State, 1618-1793",Studies the development of the European states in response to international power struggles in the 17th and 18th centuries (up to the French Revolution). 
HIST 4223,The French Revolution and Napoleon,"Traces the origins, course, and consequences of the most important modern revolution, the French Revolution of 1789. While seeking to explain how a liberal movement for progressive change soon degenerated into the factional bloodbath of the Terror, will also examine the revolution's global impact and how three decades or revolutionary warfare lead to the rise and fall of Napoleon Bonaparte. "
HIST 4227,The American West in the 20th Century,"Explores cultural, social, and political interaction in the American West during the 20th century. Themes include popular culture, state-federal relationships, environmental change, urbanization, immigration, and cultural formation. "
HIST 4232,"From Absolutism to Revolution in Europe, 1648-1789","Studies the history of Europe from the end of the Thirty Years War through the outbreak of the French Revolution. Central themes include the establishment of more centralized, increasingly bureaucratic states; global expansion and economic commercialization; cultural developments such as the Scientific Revolution and the Enlightenment. "
HIST 4233,History of France since 1815,"Examines the ongoing struggle between the revolutionary and counter-revolutionary traditions of France and how it shaped the political history and affected the social, cultural and intellectual character of the nation from 1815 to the present. "
HIST 4235,Jacksonian America,"Focuses on the social and cultural history of the Jacksonian Era. Issues include the transformation of the market economy, slavery, moral reform, Indian removal, changes in ideas about men's and women's natures and roles, western expansion, and political culture. "
HIST 4238,History of Southern Africa,Examines the history of southern Africa history from the earliest times to the present. Short background readings and lectures cover southern African's history and class discussions of novels are layered over these basics. Topics of study include Cecil Rhodes and the diamond/gold mines; Shaka and the Zulu nation; apartheid; Nelson Mandela and the antiapartheid movement; issues facing South Africa today.
HIST 4258,Africa under European Colonial Rule,"Looks at the British, French, Portuguese and German empires that undertook the Scramble for Africa in the late 19th century. Themes include slavery and the slave trade; colonization and pacification; African resistance to European rule; missionaries and converts; decolonization and anti-colonial uprisings; issues facing Africa today, including oil, war and the Rwandan genocide. "
HIST 4303,Venice and Florence during the Renaissance,"Comparative urban study of Florence and Venice from 13th through 16th centuries. Principal subjects are the distinctive economies of the cities, political developments, Renaissance humanism, patronage of the arts, and foreign policy. "
HIST 4304,The Cosmos in Premodern Mediterranean Societies,"Through a chronological investigation of ideas about the cosmos in ancient Mediterranean societies, this course communicates how ancient and premodern people thought about, described, and made space part of their daily lives. It will expose students to primary sources such as hieroglyphs, paintings, poems, lyrics & maps. By doing so students will also develop knowledge about ancient societies. The course will include lectures, student skit presentations, learning cells & one class project. "
HIST 4312,19th Century Europe,"Concerned with major social, political and cultural developments in Europe from circa 1800 to the outbreak of World War I. Special emphasis is placed upon the Napoleonic experience, the rise of modern nationalism, romanticism, Darwinism and its social applications, the Industrial Revolution, imperialism, the emergence of modern ideologies, and the background of World War I. "
HIST 4313,History of Modern Italy,"Examines the major historical, economic and social factors that have shaped the identity of modern Italy, from the enthusiasm of young patriots during Italy's unification in the 1860s to the discontent and domestic terrorism of the 1960s-1980s. Focuses on Mussolini, the Fascist movement and on World War II, as well as the changing role of women. Taught in English. "
HIST 4315,Civil War and Reconstruction,"Describes the forces at work in the antebellum period that led to sectional warfare; social, economic, and political changes effected by the war; the American agony of reconstruction; and the long-range results of that difficult era. "
HIST 4320,"The History of the Mediterranean, 600 CE-1600 CE","Familiarizes students with the Mediterranean ecumene covering concepts such as the Renaissance, the Crusades, traders and travelers, religions and cities. Explores both conflicts (military, confessional) and exchanges (commercial, artistic, scientific) thus helping students think cross culturally, comparatively and thematically. Emphasizes the Mediterranean contribution to historical developments of western Europe, the Middle East, and North Africa. "
HIST 4323,Mafia and Terrorism: Organized Violence in Italy,"Investigates the origins and development of the Sicilian Mafia and Political Terrorism in Italy. In the first part of the course, the context of Italian politics, economy and society in which the mafia was born and flourished in the 19th and 20th century will be explored. The ramification of the Mafia in the United States in the 20th c. will also be studied. In the second part of the course, the political and social causes of Italian left and right wing Terrorism will be examined, starting from the Piazza Fontana slaughter (1969) until the murder of Professor Marco Biagi (2002). Particular attention will be devoted to the kidnapping and murder of Democratic Christian Party President Aldo Moro and to the Red Brigades terrorist movement. The role of women in both Mafia and Terrorism will be explored. "
HIST 4326,Epidemic Disease in US History,"Focuses on the impact of infectious epidemic disease on American history, from smallpox and cholera to influenza, AIDS and Ebola. Addresses early depopulation of the Americas; contagion and social upheaval; interpretations of pestilence; social construction of disease; urbanization; doctors and alternative practitioners; public health; prejudice and infection; the ethics of quarantine; public versus individual interests; and the paradox of prevention."
HIST 4328,"The Modern Middle East, 1600 to the Present","Primarily from 1800 to the present. Attention divided equally between the region's political history and international relations and its patterns of economic, social and cultural modernization in the main countries. "
HIST 4329,"Islam in the Modern World: Revivalism, Modernism, and Fundamentalism, 1800-2001","Examines the more important movements of reform in Muslim world (including Africa, the Middle East and India) from the 18th century to the present, and their origins and intellectual import. Due to the trans-regional nature of this broad movement of reform, particular attention is paid to how these movements related to local political, economic and social contexts, and how they, in turn, moved across larger networks of oceanic commerce and trade. Concludes with extended case studies of Islamic reformism in modern Egypt and India, and their ultimate influence on the politics of contemporary Islamist movements, especially the intellectual position of Ussama B. Ladin. "
HIST 4336,Nineteenth-Century American Thought and Culture,"Examines the emergence of intellectual traditions and cultural trends in their social and political contexts from the early republic to the beginning of the modern era. Addresses developing arguments about democracy, religion, transcendentalism, gender, race, union/disunion, the Darwinian revolution, utopia/dystopia realism and naturalism in literature and the arts."
HIST 4338,History of Modern Israel/Palestine,"Explore the history culture, and politics of this crossroads of Europe and Asia from the late Ottoman period to the present. Topics include: nationalism and colonialism, development of Zionist ideology, Palestinian nationalism, the Jewish community (Yishusv) under British rule, the founding of the State of Israel, Arab-Israeli and Palestinian-Israeli relations, Israel's minorities, and the conflict of religion and state. "
HIST 4339,Borderlands of the British Empire,"Examines the development of the borderlands of the British empire through imperial expansion, consolidation, and early decolonization. Focuses on the 19th and early 20th centuries. Topics include domination, resistance and negotiation in areas such as India, Afghanistan, the Palestine Mandate. Aims for students to acquire skills in comparative history and to develop a better understanding of the roots of contemporary conflicts. "
HIST 4343,Spain and Portugal during the Golden Age,"Surveys the history of Spain and Portugal from the late medieval period through early modern period. Explores the thought, art, politics and socio-economic milieu of the Golden Age. Topics include attitudes toward minorities, the Inquisition, the Age of Exploration and the establishment of colonial empires in Asia and the Americas, court culture and architecture, religious conflicts and literary production. Formerly HIST 4064. "
HIST 4346,Twentieth-Century American Thought and Culture,"Examines the emergence of intellectual traditions and cultural trends in their social and political contexts from the beginning of the modern era through the onset of the postmodern. Addresses developing arguments about democracy, science, race, gender, faith, American identity, radicalism and conservatism, modernist thinking and artistic expression, and the role of intellectuals in society."
HIST 4348,Topics in Jewish History,Covers topics in Jewish history from biblical beginnings to present day. Topics vary each semester. Consult the online Schedule Planner for specific topics. 
HIST 4349,Decolonization of the British Empire,"Examines the end of the British Empire. Focuses on connections between imperial territories, such as networks of anticolonial activists and links between British decision makers. Students will acquire research skills and develop a better understanding of the roots of contemporary conflict. Prior coursework in British imperial history and excellent writing skills are required. "
