HIST 1011,"Greeks, Romans, Kings & Crusaders: European History to 1600","Examines the history and formation of Europe from its roots in the ancient Near East to Greece to the creation of Medieval states and kingdoms. Topics may include the rise of Christianity, Barbarian migrations, religious persecution, the role of gender and minority status, the growth of trade and European encounters, the Black Death, the European Renaissance the Protestant Reformation."
HIST 1012,"Empire, Revolution and Global War: European History Since 1600","Examines the history of modern Europe from 1600. Topics may include religious conflict, absolutism, the Scientific Revolution, the global impact of European colonialism and imperialism, the Enlightenment, the French and Industrial Revolutions, and the emergence of romanticism, nationalism, liberalism, socialism and modernism. Concludes by analyzing World War I and II, communist and fascist totalitarianisms, decolonization and the Cold War. Formerly HIST 1020"
HIST 1015,American History to 1865,"Examines American history from pre-Columbian times to the Civil War, including ancient cultures, exploration, colonization, Native American responses, the rise of race slavery, the American Revolution, political developments, Anglo-American expansion, slave life and culture, the market revolution, industrialization, reform and disunion. Introduces students to history as a dynamic discipline that shapes our understanding of the past and present. S. history."
HIST 1018,Introduction to Early Latin American History to 1810,"Introduces students to the history of what is now called Latin America from about 1450 to the wars of independence in the nineteenth century. Examines pertinent aspects of the societies and cultures of indigenous people, the history of European conquest, and the most salient features of the Spanish and Portuguese colonial empires in America."
HIST 1025,American History since 1865,"Explores political, social and cultural changes in American life since Reconstruction. Focuses on shifting social and political relations as the U.S. changed from a nation of farmers and small-town dwellers to an urban, industrial society; the changing meaning of American identity in a society divided by ethnicity, race and class; and the emergence of the U.S. as a world power."
HIST 1028,Introduction to Modern Latin American History since 1800,"Introduces students to the history of Latin America from independence to the present. Investigates the social implications of various models of economic development, the opportunities and difficulties resulting from economic ties with wealthier countries, the consequences of ethnic, gender and class divisions, and the struggles of Latin Americans to construct equitable political systems. "
HIST 1051,The World of the Ancient Greeks,"Surveys the emergence, major accomplishments, failures and decline of the world of the ancient Greeks, from Bronze Age civilizations of the Minoans and Mycenaeans through the Hellenistic Age (2000-30 B.C.) "
HIST 1061,The Rise and Fall of Ancient Rome,"Surveys the rise of ancient Rome in the eighth century B.C. to its fall in the fifth century A.D. Emphasizes political institutions, foreign policy, leading personalities, and unique cultural accomplishments. "
HIST 1113,Introduction to British History to 1660,"Deals with Roman, medieval and early modern periods. Covers the demographic, economic, social patterns, political and religious developments, and cultural changes that contributed to the formation of the English nation."
HIST 1123,Introduction to British History Since 1660,"Deals with the period from the 17th century to the present. Political, economic, social and imperial developments that contributed to creation of the modern industrial and democratic state are the major issues covered."
HIST 1218,Introduction to Sub-Saharan African History to 1800,"Provides an introduction to African history, beginning with early man and ending in 1800. Moves rapidly through civilizations as different as Ancient Egypt, Mali, Oyo and the Cape Colony, touching on important developments and highlighting themes relevant to the history of Africa as a whole. Including migration, technology, environment, trade, gender, religion, slavery and more. "
HIST 1228,Introduction to Sub-Saharan African History Since 1800,"Introduces students to the history of Sub-Saharan Africa from 1800 to the present. Major topics of study included the trans-Atlantic slave trade, African state-building, European colonialism, African responses to colonialism and issues facing independent African nations, ranging from debt to HIV/AIDS."
HIST 1308,Introduction to Middle Eastern History,"Interdisciplinary course that focuses on medieval and modern history of the Middle East (A.D. 600 to the present). Introduces the Islamic civilization of the Middle East and the historical evolution of the region from the traditional into the modern eras. Covers social patterns, economic life, and intellectual trends, as well as political development."
HIST 1438,Introduction to Korean History,"Surveys the history of Korea from the ancient period to the early twenty-first century. Topics will include: transnational political and cultural origins of Korea, transformation of gender relations, and effects of wars and colonial experience. Special attention given to the transnational character of historical developments in Korea, as well as historical debates involving neighboring countries in East Asia."
HIST 1518,Introduction to South Asian History to 1757,"Introduces the history of South Asia, providing a general acquaintance with the narratives and interpretations of ancient and medieval history of the Indian subcontinent from the rise of the Indus Valley Civilization in 3500 BCE to the end of the Mughal Empire in 1757 CE. Intended for students with little or no prior knowledge of the region."
HIST 1528,Introduction to South Asian History since 1757,"Introduces the history of modern South Asia from 1757 to the present. Examines themes such as the nature of British colonial state formation in South Asia, social transformation under British rule, modes of anticolonial resistance movements, particularly Mahatma Gandhi's nonviolent civil disobedience movement, Muslim nationalism and the formation of Pakistan, and current political conflicts involving India, Pakistan and Afghanistan."
HIST 1618,Introduction to Chinese History to 1644,"Introduces students to the history of China from Neolithic period to Ming period (1368-1644). Investigates the social patterns, gender relations, economic structure, intellectual trends, and political developments of China. Pays special attention to China's long-standing interaction with the rest of the world, which played a crucial role in the historical development of Chinese society. "
HIST 1623,Introduction to Central and East European History since 1770,"Examines major themes and events in the history of East-Central Europe from the late 1700s to the present. Themes include the impacts of nationalism, fascism, liberal democracy and communism in shaping the history of the region. Topics include World War I, World War II and the Holocaust, the Cold War, the fall of Communism, the Ukrainian revolution and more. "
HIST 1628,Introduction to Chinese History since 1644,"Introduces students to modern Chinese history and culture, from the 17th century to the present. Considers the pertinent aspects of modern China, focusing on its social patterns, economic structure, intellectual trends and political developments."
HIST 1708,Introduction to Japanese History,"A broad interdisciplinary survey of the history of Japan from earliest times to the 20th century. Explores the development of political institutions, social structures, cultural and religious life, economic development, and foreign relations in an historical perspective."
HIST 1800,Introduction to Global History,"The first cornerstone course for history majors applies a broad perspective to the global past in order to illuminate how common historical patterns and processes, as well as unique elements, shaped the human experience. Using a thematic approach, all topical variations of this course highlight cross-cultural interactions among societies, and, when relevant, how historical processes that began centuries ago still impact the contemporary world. Topics will vary by section. Department enforced prerequisite: 3 hours of any history coursework."
HIST 1818,Jewish History to 1492,"Focus on Jewish history from the Biblical period to the Spanish Expulsion in 1492. Study the origins of a group of people who call themselves, and whom others call, Jews. Focus on place, movement, power/powerlessness, gender, and the question of how to define Jews over time and place. Introduces Jews as a group of people bound together by a particular set of laws; looks at their dispersion and diversity; explores Jews' interactions with surrounding cultures and societies; introduces the basic library of Jews; sees how Jews relate to political power. "
HIST 1828,Jewish History Since 1492,"Surveys the major historical developments encountered by Jewish communities beginning with the Spanish Expulsion in 1492 up until the present day. Studies the various ways in which Jews across the modern world engaged with the emerging notions of nationality, equality and citizenship, as well as with new ideologies such as liberalism, socialism, nationalism, imperialism and antisemitism. "
HIST 1830,Global History of Holocaust and Genocide,"Examines the interplay of politics, culture, psychology and sociology to try to understand why the great philosopher Isaiah Berlin called the 20th century, The most terrible century in Western history. Our focus will be on the Holocaust as the event that defined the concept of genocide, but we will locate this event that has come to define the 20th century within ideas such as racism, imperialism, violence, and most important, the dehumanization of individuals in the modern world. "
HIST 2015,Themes in Early American History,"Examines major themes in the development of colonial societies in North America from the 15th to the early 19th centuries. Explores intercultural relations, economic development, labor systems, religion and society, and family life. Specific course focus may vary."
HIST 2100,Revolution in History,"Examines the causes, character, and significance of political revolution in world history. Concentrating on one of the major revolutions of modern history, it examines why revolutions occur, who participates in revolution, and to what effect. Specific course focus varies."
HIST 2110,History of Early Modern Societies,"Examines major themes in Early Modern history in a variety of global contexts. Issues to be explored could include intellectual developments, religion, popular culture, social history, economic and political changes, and states and warfare, usually in a specific region or nation (i.e. Europe, Latin America, the Atlantic World, Spain, Russia, China, Japan, etc.). Topics vary in any given semester."
HIST 2126,Issues in Modern U.S. Politics and Foreign Relations,"Traces the historical development of modern U.S. politics and foreign relations. Analyzes subjects such as the Cold War, the Vietnam War, the War on Terror, and the relationship between foreign and domestic politics, and the developing meaning of political conservatism, liberalism, and radicalism in the U.S. Explains the impact of race, gender, class, and immigration. Topics vary in any given semester."
HIST 2166,The Vietnam Wars,"Traces the causes, course, and outcome of the wars in Vietnam from 1940 until 1975. Explains the successes of the revolutionaries and the failures of the French and Americans. Analyzes the development of Vietnamese nationalism, French colonialism, and U.S. intervention. "
HIST 2170,History of Christianity 1: To the Reformation,General introduction to the history of Christianity from its beginnings through the first period of the Protestant Reformation. Examines religious life and the church in relation to its social and cultural setting.
HIST 2220,History of War and Society,"Focuses on war and society in a variety of global contexts. Explores the character, origins, and social, political, and intellectual impacts of war in contexts ranging from several centuries of international conflict to the experience of individual nations in specific wars. Topic varies in any given semester; contact Department of History for details."
HIST 2326,Issues in the History of U.S. Society and Culture,"Examines the origins, development, and impacts (social, political, cultural, economic, etc.) of significant issues and themes in the cultural,intellectual, and/or social history of the United States from independence to the present day. Explains the impact of race, gender, ethnicity, and class on these issues. Topics vary in any given semester."
HIST 2437,African American History,"Surveys African American history. Studies, interprets and analyzes major problems, issues and trends affecting African Americans from about 1600 to the present. "
HIST 2500,Fact and Fiction in History,"Examines history and historical sources through the alternating lenses of ¿fact¿ and ¿fiction¿ in order to think not only about what happened, but how we acquire information and knowledge, and how we use sources and evidence to construct our own understandings of the past and to write history. Considers how narratives found in novels, myths, movies, television, music, visual material, monuments, or public memories, represent the past and relate to historical accounts."
HIST 2516,America Through Baseball,"Baseball could not have existed without America. Explains how the game fit into the larger context of social, cultural, economic and political history from the 19th century to the present. Studies the events and people who made baseball the national pastime. "
HIST 2566,Made in America: Work and Workers in American History,"Puts the working lives of Americans, and the meaning of work in American life, in historical perspective. What counts as work and how has that changed over time? How do people's expectations of their working lives today compare to how people thought about work trajectories in the past? Whose work has been valued and whose has not? The course focuses mainly on the nineteenth and twentieth centuries while drawing parallels to the present."
HIST 2616,History of Gender in America,"Introduces the social and cultural construction of femininity and masculinity in America from 1500 to the present. Explores gender as a status acquired and performed through tasks, clothing, adornment and bodily movement. Examines gender ideals, expression and practices such as gender crossing, gender bending and gender plan."
HIST 2629,China in World History,Examines the multiple connections between Chinese history and other parts of the world over the course of China's long history. Specific course focus may vary by instructor/term.
HIST 2728,Militarism in Japanese History,"From the early use of stone and metal in the archaic period through the post-World War II resurgence of nationalism, experiences of war and the development of military ideologies have exerted transformative and far-reaching effects on Japanese history. This course embeds the events, persons, institutions, and philosophies that shaped the course of militarism in Japan within a broader social and geographic context."
HIST 2830,Disease and Public Health in Global History,"Examines the global history of health and disease from the Paleolithic to the present. Themes and topics vary by semester but may include the co-evolution of humans, microbes, and vectors; food, famine, and nutrition; mental health; contagions such as plague, smallpox, cholera, yellow fever, influenza, HIV, and coronaviruses; cultural, social, medical, and institutional developments; gender, race, and sexuality; and connections between public health and environment, climate, water supply, colonization, globalization, imperialism, migration, and transportation."
HIST 3012,Seminar in Modern European History,"Capstone seminars are designed for advanced history majors to pull together the skills they have honed in previous courses. This seminar focuses on modern European history, and will include readings and discussions in a small seminar setting. In relation to the course topic, students will develop an individual research project and write a substantial and original paper based on primary sources. "
HIST 3018,Seminar in Latin American History,"Capstone seminars are designed for advanced history majors to pull together the skills they have honed in previous courses. This seminar focuses on Latin American history, and will include readings and discussions in a small seminar setting. In relation to the course topic, students will develop an individual research project and write a substantial and original paper based on primary sources. "
HIST 3020,Historical Thinking & Writing,"The second cornerstone course for history majors centers on the essential skills all historians use. Students will advance their reading, sourcing, and research techniques, hone critical, analytical, and synthetic skills, navigate scholarly discourse, and practice historical writing. As this simultaneously satisfies the College's upper-division writing requirement, all sections involve substantial, regular, and varied writing assignments as well as instruction in methods and the revision process. All topical variations of this course are limited to a maximum of 18 students in order to focus on supporting students as they learn to write - and think - like an historian. Topics will vary by section. Recommended for sophomores or juniors, HIST 3020 may be taken concurrently with, but not prior to, HIST 1800. "
HIST 3109,Seminar in Asian History,"Capstone seminars are designed for advanced history majors to pull together the skills they have honed in previous courses. This seminar focuses on Asian history, and will include readings and discussions in a small seminar setting. In relation to the course topic, students will develop an individual research project and write a substantial and original paper based on primary sources. Previously offered as a special topics course."
HIST 3110,Honors Seminar,"Practical historiography for students who wish to write a senior honors thesis. Emphasizes choice of topic, critical methods, research, organization, argumentation, and writing. "
HIST 3112,Seminar in Renaissance and Reformation,"Capstone seminars are designed for advanced history majors to pull together the skills they have honed in previous courses. This seminar focuses on the history of the Renaissance and Reformation, and will include readings and discussions in a small seminar setting. In relation to the course topic, students will develop an individual research project and write a substantial and original paper based on primary sources. "
HIST 3113,Seminar in Medieval and Early Modern English History,"The third, and final, cornerstone course for history majors is a capstone seminar. Capstone seminars are designed for advanced history majors to pull together the skills they have honed in previous classes towards producing historical knowledge about a particular area of interest. This seminar focuses on medieval and early modern English history, and will include readings and discussions in a small seminar setting. These and other class activities and assignments will support the central goal: for each student to develop an individual research project on a topic of their own choosing in relation to medieval and early modern English history. Students will then write a substantial and original research paper based on primary sources. Completion of HIST 3020 is required for history majors to enroll in a senior seminar. "
HIST 3115,Seminar in Early American History,"The third, and final, cornerstone course for history majors is a capstone seminar. Capstone seminars are designed for advanced history majors to pull together the skills they have honed in previous classes towards producing historical knowledge about a particular area of interest. This seminar focuses on early American history, and will include readings and discussions in a small seminar setting. These and other class activities and assignments will support the central goal: for each student to develop an individual research project on a topic of their own choosing in relation to early American history. Students will then write a substantial and original research paper based on primary sources. Completion of HIST 3020 is required for history majors to enroll in a senior seminar. "
HIST 3116,Seminar in American Diplomatic History,"Capstone seminars are designed for advanced history majors to pull together the skills they have honed in previous courses. This seminar focuses on American diplomatic history, and will include readings and discussions in a small seminar setting. In relation to the course topic, students will develop an individual research project and write a substantial and original paper based on primary sources. "
HIST 3120,Honors Thesis,Department enforced prerequisite: HIST 3110 and instructor consent.
HIST 3133,Seminar in Britain since 1688,"Capstone seminars are designed for advanced history majors to pull together the skills they have honed in previous courses. This seminar focuses on British history since 1688, and will include readings and discussions in a small seminar setting. In relation to the course topic, students will develop an individual research project and write a substantial and original paper based on primary sources. "
HIST 3212,Seminar in Early Modern Europe,"Capstone seminars are designed for advanced history majors to pull together the skills they have honed in previous courses. This seminar focuses on early modern European history, and will include readings and discussions in a small seminar setting. In relation to the course topic, students will develop an individual research project and write a substantial and original paper based on primary sources. "
HIST 3218,Seminar in African History,Deals with the history and anthropology of selected west African societies in the period before the imposition of European colonial rule. 
HIST 3317,Seminar in the American West,"Capstone seminars are designed for advanced history majors to pull together the skills they have honed in previous courses. This seminar focuses on the history of the American West, and will include readings and discussions in a small seminar setting. In relation to the course topic, students will develop an individual research project and write a substantial and original paper based on primary sources. "
HIST 3328,Seminar in Middle Eastern History,Examines selected issues in modern Middle Eastern history. Check with the department concerning the specific subject of the seminar. 
HIST 3414,Seminar in Modern European Thought and Culture,"Capstone seminars are designed for advanced history majors to pull together the skills they have honed in previous courses. This seminar focuses on the history of modern European thought and culture, and will include readings and discussions in a small seminar setting. In relation to the course topic, students will develop an individual research project and write a substantial and original paper based on primary sources. "
HIST 3415,Seminar in Recent American History,"Capstone seminars are designed for advanced history majors to pull together the skills they have honed in previous courses. This seminar focuses on recent American history, and will include readings and discussions in a small seminar setting. In relation to the course topic, students will develop an individual research project and write a substantial and original paper based on primary sources. "
HIST 3416,Seminar in American Society and Thought,"Capstone seminars are designed for advanced history majors to pull together the skills they have honed in previous courses. This seminar focuses on the history of American society and thought, and will include readings and discussions in a small seminar setting. In relation to the course topic, students will develop an individual research project and write a substantial and original paper based on primary sources. "
HIST 3417,Seminar in African American History,"Capstone seminars are designed for advanced history majors to pull together the skills they have honed in previous courses. This seminar focuses on African American history, and will include readings and discussions in a small seminar setting. In relation to the course topic, students will develop an individual research project and write a substantial and original paper based on primary sources. "
HIST 3511,Seminar in Medieval History,"Capstone seminars are designed for advanced history majors to pull together the skills they have honed in previous courses. This seminar focuses on medieval history, and will include readings and discussions in a small seminar setting. In relation to the course topic, students will develop an individual research project and write a substantial and original paper based on primary sources. "
HIST 3516,"American Culture and Reform, 1880--1920","Addresses the issues of reform, religion, and culture that emerged as a 19th century world view confronted a 20th century America. "
HIST 3616,Seminar in U.S. Women's History,"Capstone seminars are designed for advanced history majors to pull together the skills they have honed in previous courses. This seminar focuses on U.S. women¿s history, and will include readings and discussions in a small seminar setting. In relation to the course topic, students will develop an individual research project and write a substantial and original paper based on primary sources. "
